<VicinityDetails xmlns="http://iaws/ws/contractfirst/carpooling"
	xmlns:xsi="http://www.w3.org/2001/XMLSchema-instance"
	xsi:schemaLocation="http://iaws/ws/contractfirst/carpooling VicinityRequest.xsd">
	
	<Teacher>
		<Id>
			<Lastname>Lastname</Lastname>
			<Firstname>Firstname</Firstname>
		</Id>
		<Mail>
			<Perso>firstname.lastname</Perso>
			<Domain>univ-tlse3.fr</Domain>
		</Mail>
	</Teacher>
	
	<Teacher>
		<Id>
			<Lastname>Nom</Lastname>
			<Firstname>Pr√©nom</Firstname>
		</Id>
		<Mail>
			<Perso>prenom.nom</Perso>
			<Domain>univ-tlse3.fr</Domain>
		</Mail>
	</Teacher>
	
</VicinityDetails>
